{
  "version": 1,
  "hardware_class": "strix-halo",
  "accelerators": [
    {
      "vendor": "amd",
      "product": "Radeon 8060S",
      "architecture": "gfx1151",
      "memory_bytes": {
        "measured": 137438953472
      },
      "count": 1
    }
  ],
  "host": {
    "cpu_arch": "x86_64",
    "cpu_model": {
      "measured": "Ryzen AI Max+ 395"
    },
    "memory_bytes": {
      "absent": "unavailable"
    },
    "unified_memory": true,
    "os_kernel": {
      "measured": "6.17.0"
    }
  },
  "driver": {
    "measured": {
      "name": "amdgpu",
      "version": "6.17.0"
    }
  },
  "toolkit": {
    "absent": "not_yet"
  }
}
